{
  "$schema": "https://agent-project-os.org/schemas/role-v1.schema.json",
  "authority": ["evaluate_agent", "propose_agent_upgrade"],
  "created_at": "2026-08-18T08:00:00Z",
  "name": "Agent HR",
  "protocol_version": "1.0",
  "purpose": "Govern Agent roles, evaluations, releases, rollback and retirement",
  "role_id": "agent-hr",
  "status": "active"
}
