{
  "$schema": "https://agent-project-os.org/schemas/role-v1.schema.json",
  "authority": ["dispatch_supervision", "review_project_report"],
  "created_at": "2026-08-18T08:00:00Z",
  "name": "PMO",
  "protocol_version": "1.0",
  "purpose": "Federate accountable project PMs and reconcile reports",
  "role_id": "pmo",
  "status": "active"
}
