{
  "$schema": "https://agent-project-os.org/schemas/role-v1.schema.json",
  "authority": ["portfolio_priority", "exception_decision"],
  "created_at": "2026-08-18T08:00:00Z",
  "name": "Agent CEO",
  "protocol_version": "1.0",
  "purpose": "Own portfolio priorities and exception decisions",
  "role_id": "agent-ceo",
  "status": "active"
}
